Column 1,Column 2,Column 3,Column 4,Column 5,Column 6,Column 7
1,Rajasthan Craft Artisans,UHUD CRAFTS Antique Wooden Fold-able Coffee Table/Side Table/End Table/Tea Table/Plant Stand/Stool Living Room Kids Play Furniture Table Round Shape,"Finishing thoda kharab hy or wood quality bhi kharab hy ekdam se ,kuch kuch place may cracks hy but overall look good
",3,https://drive.google.com/file/d/1rciThGX19nYgfYkViE9PGfJfgPs4DN04/view?usp=sharing,Seller Issue
2,Rajasthan Craft Artisans,"Rajasthan Crafts Cotton Terry Ultra Soft Waterproof Mattress Protector| Fits Upto 10 inch Bed | Breathable - Hypoallergenic Mattresses Cover (78x36 inch | 6.5x3 feet, Maroon)
",Received damaged not properly stiched....,3,https://drive.google.com/file/d/13dwOsN9yXhkYeuQyJjJAgGck0r5Mn1e1/view?usp=drive_link,Seller Issue
3,Khadi Naturals,"Khadi Natural Activated Charcoal herbal face wash for men women, 210 ml","It's a fake product. It is not actual khadi natural Brand's product. Original khadi natural product s are high quality. If you would see attached images, you will notice 'gmail' email ID and wrong website. It is fake product. Save yourself from this fraud.",1,https://drive.google.com/file/d/1E5JviyuLeqOI9DT1EhCaHl2vSOM9fCG-/view?usp=drive_link,Seller Issue
4,Rajasthan Craft Artisans,"
Naayaab Craft Wooden And Brass Saras,Wooden Antique Decorative Saras Swan Crane Love Birds Fantasy Showpiece For Home Decor-Set Of 2,Size:- Big(5 X 9 X 29Cm)&Small(5 X 9 X 20Cm)",Defective product,1,https://drive.google.com/file/d/1v84SsoLFSTLXn4xMZo6c1u_yMTCikw6U/view?usp=sharing,Seller Issue
5,Rajasthan Craft Artisans,"Streem Furniture Stool/Seat/Ottoman/Bench in Solid Sheesham Wood Stool with Cushion | Sitting Chair with Handle, Brown","Damaged package with damaged product. When I refused to receive damaged package, denied & rude behaviour by delivery agent",2,https://drive.google.com/file/d/1Ri9qKJHuzb-35Ku8jix4piqqrgkQutlO/view?usp=drive_link,Logistic Issue
6,FBA warehouse,"Swivel Faucet Aerator Rotatable Multi-Functional Extension Faucet, Faucet Extender for Taps, Tap Extender for Kitchen Sink with 2 Modes Splash Extension Faucet Filter","I have requested Amazon to return my products from the warehouse in Spain. I started receiving one by one. All packages were packet not according the standards that AMAZON sets for the sellers. How strange! Now I have counted the Items and there are products missing…
1- There is no packaging list in the return boxes!
2- The boxes are of very poor quality and marked heavy. The amazon tape is not even glued in such way that the boxes are closed
3- MRW the shipping company has attempted to tape the boxes together, but still did not succeed

I asked before - What is the procedure to claim the lost items! what email I use for this, and tho whom I address this.

Please read my comment , before you give me a run around like last time!",1,https://drive.google.com/file/d/1TxXuRsVp9PQNocpN0NFq7jgwBhkeDGWP/view?usp=drive_link,Logistic Issue
7,Rajasthan Craft Artisans,,TOTALLY DAMAGE RECEIVED.,1,https://drive.google.com/file/d/1OT6fEOPkhKSTfhaixuDRtu7M8QOYe5u7/view?usp=sharing,Logistic Issue
8,Craftfry ,"Illuminate Your Space with CRAFTFRY Glass Hanging Planter Tea Light Candle Holders - Pack of 4 for Parties, Home Decor, Weddings, Living Rooms & Halls",Received broken product,1,https://drive.google.com/file/d/1POyjS3UchejKpIpPdXFjvm-TQo1KLRNR/view?usp=drive_link,Logistic Issue
9,Weavers of Banaras (Uttar Pradesh),"WINSTON HOME Single Bed Donation Blanket, Woollen Blanket, Dan Vale Kambhal | Soft Light-Weight Bed Blanket & Soft and Cosy Fabric (Pack of 1)_Multicolor#30","The product arrived in terrible condition. The packaging was crushed, and the item inside was broken. It was evident that there was no proper cushioning or care taken to protect the item during transit. I expected better quality from this seller. Extremely disappointed!""",2,https://drive.google.com/file/d/1_XrM2RnAZbK25NVSj7LpAeeYx5-P4M0h/view?usp=drive_link,Logistic Issue
10,Ocean,"Ocean Clear New York Hi Ball, 340 Ml. | Soda Lime Glass | Set of 6 | Clear & Transparent | Used to Serve Water, Juice, Soft Drink, and Other Iced Beverages |Home Party, Offices, Hotel & Restaurant",one of the glasses in my recent order arrived broken.,1,https://drive.google.com/file/d/1xzYW2DVdHEGzSk1FqK_G8c3M2WV0PvU7/view?usp=drive_link,Logistic Issue
11,TIED RIBBONS Store,TIED RIBBONS Pack of 2 Turkish Mosaic Glass Votive Tealight Candle Holders for Table - Christmas decorations Items for Home decor Living Room Bedroom (Mosaic Glass) - Christmas decor - Christmas Gifts,It’s broken,2,https://drive.google.com/file/d/1KK_DefnTmbt-MxCgzo-i7RiAa1lswFBY/view?usp=drive_link,Logistic Issue
12,Weavers of Banaras (Uttar Pradesh),amazon basics Double Bed Sized Mink Blanket (Dark Blue),"It came torned and is of bad quality ,I wasn't expecting this product",2,https://drive.google.com/file/d/1qmBSUFs0xlv1JnLJPbrBFHr-foGa1t5f/view?usp=drive_link,Seller Issue
13,TIED RIBBONS Store,TIED RIBBONS Multicolor Flowers with Mercury Glass Vase for Home Decor Center Table Bedroom Living Room and Office Decoration (Multicolor),"Delivered only glass vase. As stated before purchase, the flowers with vase is not followed. This is cheating. Please deliver the flowers or refund the amount. This is second time I am requesting.",2,https://drive.google.com/file/d/17BsBJv_4_hSOHVxmCzDEllGw0wMSRz2Z/view?usp=drive_link,Seller Issue
14,Pattachitra Artists (Odisha),"Fevicryl Art of India Pattachitra Kit, Acrylic Paints 12 Shades, 2 Round Brushes, 2 Pre-Designed Canvases, Ideal for Festive Gifting, Artists, Students",Very low quality product is damaged,1,https://drive.google.com/file/d/1Z6cYUPmFQABl3nBrPp8ngKmdpSfWUDAG/view?usp=drive_link,Logistic Issue
15,Pattachitra Artists (Odisha),"Fevicryl DIY Art of India Mandala Art kit | Acrylic Paints 6 Shades| Set of 2 Round Brushes | 3 Pre-Designed MDF Board | for Artists, Students, Children | Ideal for Festive Gifting",Both brushes in packet are broken,1,https://drive.google.com/file/d/1kpcDJzY0MbbxuLEMm_ZAhVVH3rUtibgZ/view?usp=drive_link,Logistic Issue
16,Khadi Naturals,"Khadi Natural Ayurvedic Neem Face Wash | Gentle Face Wash for Acne | Face Wash for Acne Prone Skin | Anti-Acne Face Wash with Neem | Paraben & Sulphate-Free | Suitable for All Skin Types 210ml","PLEASE DO NOT WASTE YOUR MONEY by buying this product as it's the worst kind of facewash in the market. It has 0 visible or any kind of effect on your skin , makes your skin dryness, the smoothness of the product is as of it has a lot of glycerin . The performance is equal to none so dont fall for the marketing gimmick of 'organic and natural ' product.
You can easily make it at home.. get some soap base.. add fragrance.. aqua.. colour... Glycerin lots of it and 0.02% natural thing.",3,https://drive.google.com/file/d/1L_xRXqJC4ZvCddFC-XsxC2w3fQvmZnYX/view?usp=drive_link,Seller Issue
17,Pattachitra Artists (Odisha),"Imagimake Learn Indian Art Forms-Arts and Craft DIY Kit For Kids 8-12, 5 Indian Art Forms-Madhubani, Warli, Lippan, Mandala & Block Printing Arts, Perfect DIY for Girls Kids & Boys multi-color.",Got broken box  ,1,https://drive.google.com/file/d/1w_fn-FiS3AFqFOYfayiKJlxyFmTD0Swy/view?usp=drive_link,Logistic Issue
18,Khadi Naturals,Khadi Natural Amla & Reetha Hair Shampoo | Anti-Hair Fall Shampoo | Shampoo for Thick & Strong Hair | Ayurvedic Shampoo for Healthy Hair | Suitable for All Hair|210 ml,"This shampoo does opposite to what claimed by the company. The company claims it's ayurvedic and natural but in real it contains sulfate, cocamidopropyl betaine, CL 15985+ 16255+42090 and much more( these chemicals should not be there in this so called Ayurvedic and 100% natural shampoo). This company is just using the Khadi's name and it's not effective. I would suggest you visit the nearest khadi store and buy the genuine ayurvedic shampoo.",1,https://drive.google.com/file/d/1tK8TvcSyA2MIA_PcMCZPTXo6avsxOyuG/view?usp=drive_link,Seller Issue
19,Khadi Naturals,"Khadi Natural Bhringraj Hair Oil For Controlling Hair Fall, Nourishing Oil For Healthy Hair Growth, Paraben & Silicone-Free Suitable For All Hair Types, 210ml",it has liquid paraffin. I had extreme hair fall and have used lot of hair oils from high end brands and have not seen good results. This oil is just magic in motion and you can see the effect after the first wash itself. I don't have to use any serum and keratin treatment after using this hair oil.,1,https://drive.google.com/file/d/1zWDcB-PX4eW2XgzAnr9gpHrAbHX6Lkqn/view?usp=drive_link,Seller Issue
20,Khadi Naturals,Khadi Natural Protein Hair Cream for Soft & Shiny Hair | Cream for Silky Hair | Natural Hair Cream for Dry Hair | Paraben & Silicone-Free | Suitable for All Hair Types| 150g,Product is used one. Not the new ..it seems like some one used some part. Would like to exchange the hair cream khadi natural .,1,https://drive.google.com/file/d/102LPM9T-Laeyz0B4qZ5g4bq9icxRJnfi/view?usp=drive_link,Seller Issue
21,Khadi Naturals,Khadi Natural Travel Kit | Skincare & Haircare Essentials On-The-Go | Lightweight & Easy to Carry | Perfect for All Skin & Hair Types | Compact Travel-Friendly Pack,Product is little different as shown in picture....kit is also not as shown.... Not happy.. One of the bottle leaked and it ruined other things in the bag as well. Defective product sent.,1,https://drive.google.com/file/d/1hSPvoMK7JY7vOj0rSaoVixka0dRblFti/view?usp=drive_link,Seller Issue
22,Sonata,Sonata Sona Sitara Analog White Dial Women's Watch NM8073YM01/NN8073YM01,"I have received a damaged product for the second time. This time I opened the pack infront of delivery boy. The belt was broken. And the tag of the product was not properly placed, it was somewhere kept inside the box. So anyone can use it and then claim for replacement.",1,https://drive.google.com/file/d/1h0mKBSeRkmG22dL3Z0WeFk6CJ3v2RBlu/view?usp=drive_link,Seller Issue
23,M-fit,"m-fit Brass Hammered Kadhai for Cooking/Serving Pital Kadhai - 1700ml, Gold (9x3-inches)",Damaged product selling online.,2,https://drive.google.com/file/d/1v6yFHi-xC1CHrYmce3N5hVDzjqCikvSw/view?usp=drive_link,Seller Issue
24,Sugar Cosmetics ,"SUGAR Cosmetics Contour De Force Face Palette for Makeup | Includes Matte Bronzer, Highlighter & Blush | Makeup Palette with Built-in Mirror | 12.5gm - 02 Vivid Victory",I had seen many reviews where they had shown the damaged product. But went ahead to try my luck! And got damaged one!,2,https://drive.google.com/file/d/1vetzmN_uchiJ3GPppF-6CE4GfA7d9Ktk/view?usp=drive_link,Seller Issue
25,Forest Herbs Naturals (Uttarakhand),Forest Essentials Delicate Facial Cleanser with Saffron & Neem | Ayurvedic Purifying Face Wash | For Combination to Oily Skin | Sulphate Free | Paraben Free,Received a damaged product.No replacement available :(,1,https://drive.google.com/file/d/1I6M0KaTizv65AGrYyeTMO8GiHZmw6BZ5/view?usp=drive_link,Seller Issue
26,TIED RIBBONS Store,TIED RIBBONS Set of 2 Hanging Lantern Tealight Candle Holder for Dining Table Home Decorations - Christmas Decorations Items for Home Decor (Yellow and Blue) - Christmas Decor - Christmas Gifts,Broken product and damaged,1,https://drive.google.com/file/d/11TngFpTuCCgyxqKTS1GwylQ2AHXdLjC4/view?usp=drive_link,Logistic Issue
27,Loreal,Loreal Shampoo,The shampoo bottle was broken and the product were spilled all over. No replacement option.. Totally unhappy with the purchase.. Even the masque is a fake one.. I have used this previously but this time the contents are different from the last one.,1,https://drive.google.com/file/d/10aMvYyE8YZlDW5p2nPfqVftGrAwHHsNw/view?usp=drive_link,Logistic Issue
28,TIED RIBBONS Store,Tied Ribbons Urli Bowl with 10 Attached Oil Diyas for Floating Flowers and Tealight Candles (29 cm x 5 cm) - Diwali Decoration Items for Home Decor - Diwali Decor - Diwali Gifts,I am so disappointed by this product. Just used it for 2 days on Diwali and it got Rust all over it. It is very cheap quality. Do not buy,1,https://drive.google.com/file/d/1XJRNqfhtO7qF5WnbadmiBEmAWS2hWXbf/view?usp=drive_link,Seller Issue
29,TIED RIBBONS Store,"Tied Ribbons Pack Of 6 Artificial Chrysanthemum Ball Flowers Stick Bunch (Dark Red, 29 Cm) For Vase Pot Home Decor Living Room Bedroom Office Table Decoration Items (Pot Not Included) - Polyester",Its very grand in its size for large arrangwments. However the colour is darker. It is not pastel pink as shown which was the colour needed,1,https://drive.google.com/file/d/1hmLNY3PR9BoYRGHgucaN7rPgCqT5CDsf/view?usp=drive_link,Seller Issue
30,eCraftIndia,"eCraftIndia Colorful 4 Monks Buddha Figurines - for Home Decor| Office Decor| Chrismas Decor| Diwali Decor| Vaastu Decor| Fengshui
",Broken Piece is delivered to me,1,https://drive.google.com/file/d/1YxuroINAhcravSfouxbKqL30fUAHJwdy/view?usp=drive_link,Logistic Issue
31,TIED RIBBONS Store,"TIED RIBBONS Set of 2 Christmas Reindeer Tealight Candle Holders with Glass Holders - Christmas Decorations Items for Home Table Decoration Indoor Outdoor (Iron) - Christmas Decor - Christmas Gifts
byTIED RIBBONS",Just ordinarily painted black.. Makes it look very cheap quality product.. Moreover if you light tealight in black rim over the glass which holds the glass will cover candle flame which reduces over all light effect..,1,https://drive.google.com/file/d/1b3adCP1gr2ri6wpVoEGNYdcVnJMlo62Y/view?usp=drive_link,Seller Issue
32,TIED RIBBONS Store,"TIED RIBBONS Set of 4 Owls Playing Musical Instruments Showpiece Figurines Garden Statues Decoration Items for Home Outdoor Decorations (Multicolor)
byTIED RIBBONS",I bought this product 2 times and both the times i got broken owls.....don't buy this...,1,https://drive.google.com/file/d/1Ea9ex5_KHJpEdQj0JQc0MAeZXGD49ylm/view?usp=drive_link,Logistic Issue
33,TIED RIBBONS Store,"TIED RIBBONS Silk 10 Pcs Artificial Calla Lily Flowers Bunch For Vase And Flower Pots (33 Cm Each, White) - Home Decor Item For Centerpiece Living Room Corner Table Decorations (Pot Not Included)
byTIED RIBBONS",Got dull and discoloured product,1,https://drive.google.com/file/d/1obbPoHX86VJdW5nqoSaO5Z3GO1C7MqMd/view?usp=drive_link,Seller Issue
34,Collectible India,Collectible India Laxmi Ganesh Saraswati Idol Diya Oil Lamp Deepak - Metal Lakshmi Ganesha Showpiece Statue - Traditional Diya for Diwali Puja - Diwali Home Decoration Items Gifts (1) (1),Damaged,1,https://drive.google.com/file/d/1wM8ybR6NBfd-1chqMDyDRC-K7XtkU0kh/view?usp=drive_link,Logistic Issue
35,TIED RIBBONS Store,"TIED RIBBONS Glass Vase For Flowers And Plants Living Room Home Décor Table Centerpiece Wall Shelf Home Decoration (29 Cm, 165 Cm, Set of 2 Without Flowers, Clear).
byTIED RIBBONS","Received badly damaged item.
Returned",1,https://drive.google.com/file/d/1s75iwiqHcvJxEEOp8NKd_sGIUaOU1-3j/view?usp=drive_link,Logistic Issue
36,TIED RIBBONS Store,"TIED RIBBONS Glass Round Vase For Flowers And Plants Living Room Home Décor Table Centerpiece Wall Shelf Home Decoration (8 X 29 Cm, Clear Without Flowers, Clear)
byTIED RIBBONS",The vase was delivered broken! It seems it was packed broken!,1,https://drive.google.com/file/d/1vy-FgvTH7UMRe6psDXInmF7xHYqZIjiV/view?usp=drive_link,Logistic Issue
37,TIED RIBBONS Store,"7 Inch Glass, Flower Vase, Glass Vase For Home Office, Home Decor Center Table Bedroom Living Room And Office Decoration (Pack Of 1) Flower Pot, Decorative Vas, White",I would like to return the broken vase,2,https://drive.google.com/file/d/1sbv2sUbAqMrC0C2x-nq1VMeDzUrTXOlG/view?usp=drive_link,Logistic Issue
38,indus valley,INDUS VALLEY Bio Organic Hair Reborn Aloe Vera Gel With Bhringraj & Walnut Oil For Ultimate Hair Management (175ml),"A good quality plastic could be used, the cap has mended before receiving. The plastic was so thin. Now, to screw and unscrew it feels so hard and should press it tightly, without proper storage how can a product last long.Even small scale businesses use better jars.",3,https://drive.google.com/file/d/1e9AsEBbfdeiQPGGTfhq5Z9sD9fDW7H-U/view?usp=drive_link,Seller Issue
39,indus valley,"The Indus Valley Stainless Steel Sandwich Bottom Stock Pot/Handi/Cook-N-Serve Bowl With Steel Lid|19Cm/ 5.7 Inch,2Ltr,0.72Kg|Induction Friendly|3-Layer Bottom,100% Toxin-Free,1.5 Liter",A very bad product.I got it in poor packaging.. The box was damaged,1,https://drive.google.com/file/d/1IoyfgE8oK1P7o9pdPocODO48XURNfLq_/view?usp=drive_link,Logistic Issue
40,indus valley,The Indus Valley Pre-Seasoned Cast Iron Cookware Set+ Free Tadka Pan|Tawa (30.5 Cm)+ Kadai (25.4 Cm/2.3L)+ Fry Pan (23 Cm/1.4L)|Kitchen Cooking Combo Pots & Pans Set Of 4Pcs|Naturally Nonstick - Black,"I was excited to receive this cast iron skillet, but unfortunately, it did not meet my expectations. Upon opening the package, I found the skillet had significant rust spots and was not pre-seasoned as advertised.Pros:Solid construction and weight.Potential to be a great skillet with proper care and seasoning.Cons:Arrived with rust, which required extensive cleaning before use.Not pre-seasoned, contrary to the product description.Required additional time and effort to make it usable.Overall, I'm disappointed with this purchase. I was hoping for a ready-to-use skillet, but instead, I had to spend considerable time scrubbing off the rust and seasoning it myself. If you're looking for a cast iron skillet that's ready to use out of the box",2,https://drive.google.com/file/d/1Huwd7uYzT20mfH0lT30UxYvUEMID-IoW/view?usp=drive_link,Seller Issue
41,Pintolla,Pintola All Natural Peanut Butter (Crunchy) | Unsweetened | 30g Protein | Non GMO | Gluten Free | Vegan | Cholesterol Free (350g),Received a damaged product ...donno it's a problem with delivery boy or the package it's self is an issue..and this item doesn't have return policy,1,https://drive.google.com/file/d/16xYGw1DQOEkbu0NicBk6IkCSeF4E8iuQ/view?usp=drive_link,Logistic Issue
42,Nurturing Green,Nurturing Green® Set of 3 Ivory Self Watering Indoor Pots for Plants | Low Maintenance Flowers Pot Suitable for Home & Balcony Decor (5.5 Inch Wide*5 Inch High) - [Plant & Stand are not Included],"Received damaged piece
I had ordered 6 pieces but received only 3 pieces",1,https://drive.google.com/file/d/1QcvrEtguqO_lby2Sfunk5YHnpg_ai7bx/view?usp=drive_link,Logistic Issue
43,Zizira,Anveshan Turmeric Latte 100g | Healthy Ayurvedic Remedy with Ashwagandha Mix for Golden Milk | Haldi Mix,Received product with 15 days ExpiryOrder received on 26 october 2024 with expiry on 12 november 2024.,1,https://drive.google.com/file/d/1_JWqxM9VWWg6dQG5-V0jQsKhYPPIpeUZ/view?usp=drive_link,Seller Issue
44,Nurturing Green,Nurturing Green® Combo of 4 Assorted Self Watering Plastic Pot for Plants | Flower Pots Indoor | Indoor Pots for Living Room (4.5 Inch Wide*4.33 Inch High),Beautiful pot but one pot is broken...,1,https://drive.google.com/file/d/1iYZQTRz1aasKte41Uzcy96i0YctwYj2W/view?usp=drive_link,Logistic Issue
45,TWO BROTHERS,"Two Brothers Organic Farms - Peanut Butter Crunchy (500 grams) | Sweetened with Jaggery | Nutrients & Minerals Rich | Good Source of Protein, Fiber, Vitamin E | Vegan Butter Made Using Only Peanuts",Broken bottle delivered. What can i say about the taste when i did not get to taste it. The package was badly smuged with the butter from inside.,1,https://drive.google.com/file/d/11XagsxTaZiu-UIkzNXrikPBb6D6sn6iU/view?usp=drive_link,Logistic Issue
46,Kraft Seeds Store,"Kraft Seeds by 10CLUB 14inch Window Planters/ pots for plants, flower pot plant pots planters plastic pots for plants, plant pots for home décor flower pots for garden (Pack of of 1, Green)","Broken
Did not expect this type of product. Bad quality.",1,https://drive.google.com/file/d/1tn3uQWt0GHvXJoQcSVSUHuAJMaABGNUa/view?usp=drive_link,Logistic Issue
47,"Ocean Mart Store","Plastic Hanging Planters 5 Pcs (8 Inch, Multicolor) | Flower Hanging Pots for Home & Balcony Garden | Hanging Planters for Home Plants | Hooked Hanging Pots","Received broken item
Quality not good. Brittle & thin plastic material.Received 1 number cracked. Photo included.",2,https://drive.google.com/file/d/1tn3uQWt0GHvXJoQcSVSUHuAJMaABGNUa/view?usp=drive_link,Logistic Issue
48,TrustBasket Store,TrustBasket UV Treated Plastic Round Pot(6 Inches)-Set of 6 | Heavy Duty Highly Durable Plant Container Gamla for Indoor Home Decor & Outdoor Balcony Garden,"Very bad product recieved but not return option is available
Very bad product",1,https://drive.google.com/file/d/1_PHvIxs5cpLezXsQecIl_-thRd4W3MWY/view?usp=drive_link,Logistic Issue
49,Sparx,"Sparx mens SS 453 | Latest, Daily Use, Stylish Floaters | Grey Sport Sandal - 8 UK (SS 453)","I ordered Spark sandals online from Amazon on September 8, 2024. The sandals are completely damaged; the color has changed, they are peeling from all sides, and they have broken. Since they are expensive sandals, we have incurred a loss because we trusted the quality when we ordered them.",2,https://drive.google.com/file/d/1pXj5tUEnIHnz4qliqjxg8N1GXjuh2EC4/view?usp=drive_link,Seller Issue
50,Del Monte,Del Monte Royal Fresh Arabian Dates 500 Grams,Some dates are full of fungus.. don't eat directly from packet.. cut the dates and check.. then eat..,1,https://drive.google.com/file/d/1KmA3AvsqNlgGQ64Rg5SyWMstvjKHU9uE/view?usp=drive_link,Seller Issue
51,Dukes,"
Dukes Waffy Chocolate flavoured rolls (300g)",All pieces were broken in to small size. Some were crushed. We can't return it. Taste was ok.,2,https://drive.google.com/file/d/1rITZqSSiSLWrg2OnkkSXyaAUDwsCTsYd/view?usp=drive_link,Seller Issue
52,KREATIVE ART’S,KREATIVE ART’S® Lotus Candle Holder | Show Pieces for Home Decor | Dining Table Decorative Items | Decorative Items for Home| Diwali Decoration Items for Home Decor (Pack of 1-Large),My damaged product was not replaced,2,https://drive.google.com/file/d/1kaIZ1ReFuLlSNPHTR4i9WNZ0-BGUwVVA/view?usp=drive_link,Logistic Issue
53,AICA Store,Aica Personalized Name LED Night Table Lamp (White Base)| Gifts for Men Women | Customized Gifts for Christmas Secret Santa Happy New Year Men Women Husband Wife Girlfriend Boyfriend Office Colleagues,"There r so many scratches on plate",3,https://drive.google.com/file/d/1QG0JWdbmYdrTUlXYtkd3qVxrba1drOsc/view?usp=drive_link,Seller Issue
54,CPENSUS,"CPENSUS Acrylic Diy - Do It Yourself - Tulip Cube Mirror Lamp, 30 Flowers Led Decorative Lamp, 2 In 1 Mirror & Table Ornaments For Bedroom Livingroom Desktop Decor Birthday Gift multicolor","The quality and the polished glass is very bad, spots of peeled off polish is there. Disappointed",3,https://drive.google.com/file/d/1dsB1iuNcsrua9pgwknjg9h9NsAi2UOXN/view?usp=drive_link,Seller Issue
55,CASPIAN ,"Caspian Bolt Customised Stainless Steel Water Bottle 1L, Green with Logo Print - Personalised Water Bottle with Your Name Print for Kids Boys Girls School Office Gym- Perfect for Corporate Gifting",After filling water its started leaking continuously.,1,https://drive.google.com/file/d/1smwxmdWoRmWt8KwWztsZcFxWA-wpLMpH/view?usp=drive_link,Seller Issue
56,lampees,"lampees Personalized 3D Illusion LED Table Lamp | Heart Shape Customized Name Lamp for Couple Gift Anniversary, Wedding, Marriage, Valentine Day (Warm White)(LV-015)",I want my amount ..it’s destroyed not working lamp and LED light,1,https://drive.google.com/file/d/1bXI1d1v-5QdG-52fIxlKKF0N9bs5p_Cb/view?usp=drive_link,Seller Issue
57,Custom,"Custom Name Neon Light for Wall Home Decor, Customized Neon Sign Lights Personalized Gift for Men, Women, Husband, Wife, Girls, Boys (1 Letter)
byCustom","Broken and damaged , not working",1,https://drive.google.com/file/d/1yI_2NOwuJtciQDoQ8r7SpXOlvm50Zkv1/view?usp=drive_link,Logistic Issue
58,JUAREZ,"Juârez Acoustic Guitar Kit, 38 Inch Cutaway, 038C with Bag, Strings, Pick and Strap, Black","I have ordered it and first time it came with box open and damaged from its lower edges , later i ordered replacement of it and then again one damaged guitar came which was looking like it was using or used by someone else for months then I returned the product. And it's knobs are also plastic one but I prefer one should buy which costs around 4-5k minimum",1,https://drive.google.com/file/d/1fKqREFPKoJfL9hTLM7J4LhKoaQR2dnDf/view?usp=drive_link,Seller Issue
59,Electrobot,"Electrobot DIY Ultrasonic Distance Sensor Starter Kit for UNO R3, LCD1602, Breadboad, DC Motor, Starter/Beginner Kit for Uno R3 microcontroller with User Manual/Guidebook(PDF) and C Code
byElectrobot",Main controller is missing.,3,https://drive.google.com/file/d/1jeQP6FDaHa4on_z9bK7MKr1L3XdVaG8K/view?usp=drive_link,Seller Issue
60,Electrobot,"Electrobot RFID Starter Kit for UNO R3 from Knowing to Utilizing, Servo, RC522 RFID Module, PS2 Joystick, Learning Kit with Guidebook","I brought this kit. Firstly the sensors and the Arduino work fine. But the LCD screen, the RFID token & some LEDs do not work properly. The motor driver(L9110d) is absent and only one of 74HC595 is present but two of them are mentioned in the content sheet, some of the jumper wires are broken and the headers are bent. The contents are not well arranged and no proper box is provided. The breadboard was not good and not well sized. Some parts could not be put into the breadboard.",,https://drive.google.com/file/d/1kez1DcR_IAxt9-aeuy0LZYh9-j8_Pyit/view?usp=drive_link,Seller Issue
61,EAT BETTER CO,"EAT BETTER CO Hazelnut & Chocolate Sugar-Free Laddoos|High Protein & Instant Energy|95% Dry-Fruits-Pack Of 20-Healthy Chocolate No Added Sugar|Healthy Snacks|Energy-Bar Replacement, 200Gram","Messy , Cons: Very small-sized, a few laddoos were found broken inside the pack.

Overall, kids or senile folks carving for sweets may like the different taste of these small-sized laddoos. For me it was not value for money, in fact waste of money due to these broken ladoos.",2,https://drive.google.com/file/d/1ucI6VJnOrLk4c1Kyn3f2pDydax-JBpcv/view?usp=drive_link,Seller Issue
